title,author,reviewer,paid review?,editor (internal use),genre,"Author Diversity (1=yes, 0=no)","Gender (1=woman, 0=man)",reviewer link,reviewer ID,isbn,oclc,hide_ibooks,book_seamus_id,tags,genre (internal use),text
The Visiting Privilege,Joy Williams,Michael Schaub,1,Rose,,,1,,,,,,,"Family Matters, Poetry & Short Stories, Rather Long, Seriously Great Writing, Realistic Fiction",,"The Visiting Privilege is the rare collection that doesn't have a single story, even a single paragraph, that's less than brilliant, and it proves that Williams is quite possibly America's best living writer of short stories. She is our poet laureate of loss and mourning, but she's so much more than that — she seems to have a supernatural ability to show what makes us function as people, at our best and at our worst. And most importantly, she celebrates our vulnerabilities, the moments that make us so imperfect and broken and essentially human."
"Don’t Suck, Don’t Die",Kristin Hersh,Michael Schaub,1,Rose,,,1,,,,,,,"Biography & Memoir, For Music Lovers, Rather Short, Seriously Great Writing, The Dark Side",,"Throwing Muses frontwoman Hersh recounts the time she spent with her friend Vic Chesnutt, the indie rock legend who died in 2009 at age 45. Written mostly in the second person, it’s essentially a tender, angry love letter to Chesnutt. Don't Suck, Don't Die is not only one of the best books of the year, it's one of the most beautiful rock memoirs ever written. Hersh is as stunningly talented an author as she is a musician, and her portrayal of Chesnutt is perfectly done."
Find Me,Laura van den Berg,Michael Schaub,1,Rose,,,1,,,,,,,"Book Club Ideas, Science Fiction & Fantasy, Seriously Great Writing, The Dark Side",,"Van den Berg’s novel follows Joy, a young woman who’s taken to a hospital in rural Kansas after surviving a pandemic that has killed hundreds of thousands of Americans. Find Me is both touching and haunting, an extremely powerful look at the fragility of human life, the connections we make in dire circumstances, and the will to survive even when it seems like there’s no point."
Barbara the Slut,Lauren Holmes,Michael Schaub,1,Rose,,,1,,,,,,,"Poetry & Short Stories, Book Club Ideas, Funny Stuff, Realistic Fiction",,"The characters in Holmes’ debut short story collection are fully, sometimes exasperatingly real, portrayed by a young writer with a great deal of charm and not a hint of pretension. The stories in this book are sometimes painful, sometimes brilliantly funny, and most often both; Holmes can find the humor in the worst situations, and the tragedy in the most glorious moments. But it's her characters that carry the stories — imperfect, difficult and defiantly human. In other words, they're people. Just like us."
Speak,Louisa Hall,Michael Schaub,1,Rose,,,1,,,,,,,"Eye-Opening Reads, Historical Fiction, It’s All Geek to Me, Science Fiction & Fantasy, Seriously Great Writing",,"An inventor is imprisoned for making baby dolls that are too realistic. A Puritan girl, married against her will, sails to America with her dog. A programmer’s wife shuns him in favor of a sentient computer he created. In this stunning and audacious second novel from author Hall, perspectives shift between different eras and places, twisting together to form a story that's as hard to describe as it is remarkable.It's not just one of the smartest books of the year, it's one of the most beautiful ones."
The Water Museum,Luis Alberto Urrea,Michael Schaub,1,Rose,,,0,,,,,,,"Poetry & Short Stories, Realistic Fiction, Seriously Great Writing",,"Most of the stories in The Water Museum take place in the American West and Southwest, but they’re all universal. It's difficult to find comparisons to an author as original as Urrea, but you could say that he's kind of a country-punk Lorrie Moore, compassionate but hard-edged, a kind of literary badass who still believes in love, because sometimes, there's nothing much else to believe in. The Water Museum is a brilliant, powerful collection, and Luis Alberto Urrea is a master storyteller with a rock 'n' roll heart."
In the Country,Mia Alvar,Michael Schaub,1,Rose,,,0,,,,,,,"Poetry & Short Stories, Book Club Ideas, Realistic Fiction, Tales from Around the World",,"Set variously in the Philippines, the U.S. and Bahrain, In the Country is a stunning short story collection about people who have little to nothing in common with one another, except that they're all trying to find a home, and it's always a more challenging task than anyone would expect. Alvar finds beauty in the unlikeliest of places, and that's what makes In the Country such an inspired, remarkable book."
The Sellout,Paul Beatty,Michael Schaub,1,Rose,,,0,,,,,,,"Book Club Ideas, Funny Stuff, Seriously Great Writing",,"The story of an African American man who attempts to bring back slavery and resegregate his Los Angeles neighborhood, The Sellout is the funniest American satire in years. It's a risky book unconcerned about offending readers, and also a comic masterpiece. But it's much more than just that — it's one of the smartest and most honest reflections on race and identity in America in a very long time, written by an author who truly understands what it means to talk about the history of the country."
See How Small,Scott Blackwood,Michael Schaub,1,Rose,,,0,,,,,,,"Eye-Opening Reads, Mysteries & Thrillers, Realistic Fiction, The Dark Side",,"Blackwood’s novel is inspired by inspired by the Austin yogurt shop murders, a grisly unsolved case from 1991, in which four young girls were murdered, and the store where they worked was set ablaze. Blackwood writes with compassionate eyes, beautifully poetic writing and artistic fearlessness. See How Small is a brutal, necessary and near perfect novel."
Among the Wild Mulattos,Tom Williams,Michael Schaub,1,Rose,,,0,,,,,,,"Eye-Opening Reads, Funny Stuff, Poetry & Short Stories, Seriously Great Writing",,"Identity, both racial and otherwise, is at the heart of nearly all the stories in Among the Wild Mulattos, a manic, cutting and frequently hilarious collection from Kentucky author and academic Williams. He's an uncompromising writer with a fiercely original voice, and he's created one of the most unforgettable books of the year. The collection feels vital, essential, not only for the unexpected ways Williams talks about identity, but for his brash, gutsy writing."
Book of Numbers,Joshua Cohen,Robert Siegel ,0,Rose,,0,0,,,,,,,,,
Widow Basqiuat,Jennifer Clement,Saeed Jones,1,Rose,,,,,,,,,,,,
A Wild Swan,Michael Cunningham,Saeed Jones,1,Rose,,,,,,,,,,,,
Spectacle,Pamela Newkirk,Saeed Jones,1,Rose,,,,,,,,,,,,
Boy With Thorn,Rickey Laurentiis,Saeed Jones,1,Rose,,,,,,,,,,,,
,,,153,Target = 157 paid reviews,,,106,,,,,,,,,